indicator_id,name_zh,name_en,indicator_category,section,unit,frequency,country_coverage,year_coverage,primary_source,backup_source,source_reliability_level,is_raw_value,is_computed_value,is_derived_value,included_in_cross_country_comparison,included_in_five_year_change,included_in_mean_gap,included_in_rank_change,future_model_candidate,upward_meaning,missing_value_treatment,pending_value_treatment,updated_at,note
"population","人口","Population","macro","基础宏观","人","annual","十国","2021-2025","Eurostat demo_pjan","各国统计部门人口数据库","A","true","false","false","false","false","false","false","true","数值上升通常代表人口规模扩大，可作为经济体量和人均指标分母背景。","不使用插值；若年度缺失，保留缺失并标注待接入。","待接入行保留指标单位，数值显示待接入，状态与来源状态均显示待接入。","2026-07-17","转换方式：level；当前仅作为研究数据结构字段，不代表模型已启用。"
"gdp_current_eur","GDP","GDP, current prices","macro","基础宏观","百万欧元","annual","十国","2021-2025","Eurostat nama_10_gdp","各国统计部门国民账户","A","true","false","false","false","false","false","false","true","数值上升通常代表以当年价格计的经济总量扩大，但需结合通胀和汇率背景解释。","不使用插值；若年度缺失，保留缺失并标注待接入。","待接入行保留指标单位，数值显示待接入，状态与来源状态均显示待接入。","2026-07-17","转换方式：level；当前仅作为研究数据结构字段，不代表模型已启用。"
"gdp_per_capita_eur","人均 GDP","GDP per capita","macro","基础宏观","欧元","annual","十国","2021-2025","Eurostat nama_10_pc","各国统计部门国民账户","A","true","false","false","false","false","false","false","true","数值上升通常代表按人均口径的经济产出提高，但不直接等同于收入分配改善。","不使用插值；若年度缺失，保留缺失并标注待接入。","待接入行保留指标单位，数值显示待接入，状态与来源状态均显示待接入。","2026-07-17","转换方式：level；当前仅作为研究数据结构字段，不代表模型已启用。"
"real_gdp_growth","GDP 实际增长","Real GDP growth","macro","基础宏观","%","annual","十国","2021-2025","Eurostat nama_10_gdp","各国统计部门国民账户","A","true","false","false","false","false","false","false","true","数值上升通常代表实际经济增长加快；负值代表实际产出收缩。","不使用插值；若年度缺失，保留缺失并标注待接入。","待接入行保留指标单位，数值显示待接入，状态与来源状态均显示待接入。","2026-07-17","转换方式：annual percentage change；当前仅作为研究数据结构字段，不代表模型已启用。"
"hicp_inflation","CPI / HICP 通胀率","CPI / HICP inflation","macro","基础宏观","%","annual","十国","2021-2025","Eurostat prc_hicp_aind","各国统计部门价格指数","A","true","false","false","false","false","false","false","true","数值上升通常代表消费价格压力上升，需结合工资、利率和能源价格解释。","不使用插值；若年度缺失，保留缺失并标注待接入。","待接入行保留指标单位，数值显示待接入，状态与来源状态均显示待接入。","2026-07-17","转换方式：annual average rate of change；当前仅作为研究数据结构字段，不代表模型已启用。"
"unemployment_rate","失业率","Unemployment rate","macro","基础宏观","%","annual","十国","2021-2025","Eurostat une_rt_a","各国统计部门劳动力调查","A","true","false","false","false","false","false","false","true","数值上升通常代表劳动力市场闲置程度上升。","不使用插值；若年度缺失，保留缺失并标注待接入。","待接入行保留指标单位，数值显示待接入，状态与来源状态均显示待接入。","2026-07-17","转换方式：level；当前仅作为研究数据结构字段，不代表模型已启用。"
"fiscal_balance_gdp","财政赤字/GDP","Government deficit / GDP","fiscal","财政","% GDP","annual","V4 四国","2021-2025","Eurostat gov_10dd_edpt1","各国财政部 / 统计部门 / 欧盟稳定与增长程序文件","A","true","false","false","true","true","true","true","true","数值越高通常代表财政余额改善；负值绝对值扩大通常代表财政赤字压力上升。","不使用插值；若年度缺失，保留缺失并标注待接入。","待接入行保留指标单位，数值显示待接入，状态与来源状态均显示待接入。","2026-07-17","转换方式：level；当前仅作为研究数据结构字段，不代表模型已启用。"
"government_debt_gdp","政府债务/GDP","Government debt / GDP","fiscal","财政","% GDP","annual","V4 四国","2021-2025","Eurostat gov_10dd_edpt1","各国财政部 / 统计部门 / 欧盟稳定与增长程序文件","A","true","false","false","true","true","true","true","true","数值上升通常代表政府债务负担上升。","不使用插值；若年度缺失，保留缺失并标注待接入。","待接入行保留指标单位，数值显示待接入，状态与来源状态均显示待接入。","2026-07-17","转换方式：level；当前仅作为研究数据结构字段，不代表模型已启用。"
"government_revenue_gdp","财政收入/GDP","Government revenue / GDP","fiscal","财政","% GDP","annual","V4 四国","2021-2025","Eurostat gov_10a_main","各国财政部 / 统计部门","A","true","false","false","true","true","true","true","true","数值上升通常代表政府收入占经济总量比重提高，可反映税收能力或财政汲取程度变化。","不使用插值；若年度缺失，保留缺失并标注待接入。","待接入行保留指标单位，数值显示待接入，状态与来源状态均显示待接入。","2026-07-17","转换方式：level；当前仅作为研究数据结构字段，不代表模型已启用。"
"government_expenditure_gdp","财政支出/GDP","Government expenditure / GDP","fiscal","财政","% GDP","annual","V4 四国","2021-2025","Eurostat gov_10a_main","各国财政部 / 统计部门","A","true","false","false","true","true","true","true","true","数值上升通常代表政府支出占经济总量比重提高，需结合收入、赤字和周期位置解释。","不使用插值；若年度缺失，保留缺失并标注待接入。","待接入行保留指标单位，数值显示待接入，状态与来源状态均显示待接入。","2026-07-17","转换方式：level；当前仅作为研究数据结构字段，不代表模型已启用。"
"exports_goods_services","出口","Exports of goods and services","external","外部经济","百万欧元","annual","V4 四国","2021-2025","Eurostat nama_10_gdp","各国统计部门国民账户 / 海关 / 外贸统计","A","true","false","false","true","true","true","true","true","数值上升通常代表出口规模扩大，但需结合进口、贸易差额和价格因素解释。","不使用插值；若年度缺失，保留缺失并标注待接入。","待接入行保留指标单位，数值显示待接入，状态与来源状态均显示待接入。","2026-07-17","转换方式：level；当前仅作为研究数据结构字段，不代表模型已启用。"
"imports_goods_services","进口","Imports of goods and services","external","外部经济","百万欧元","annual","V4 四国","2021-2025","Eurostat nama_10_gdp","各国统计部门国民账户 / 海关 / 外贸统计","A","true","false","false","true","true","true","true","true","数值上升通常代表进口规模扩大，可能反映内需、能源依赖或中间品需求上升。","不使用插值；若年度缺失，保留缺失并标注待接入。","待接入行保留指标单位，数值显示待接入，状态与来源状态均显示待接入。","2026-07-17","转换方式：level；当前仅作为研究数据结构字段，不代表模型已启用。"
"trade_balance","贸易差额","Trade balance","external","外部经济","百万欧元","annual","V4 四国","2021-2025","由 Eurostat P6 出口与 P7 进口计算","各国统计部门 / 海关贸易差额","A","false","true","false","true","true","true","true","true","数值上升通常代表贸易余额改善；负值扩大代表贸易逆差扩大。","若出口或进口任一缺失，则贸易差额标记为缺失，不做单边估算。","待接入行保留指标单位，数值显示待接入，状态与来源状态均显示待接入。","2026-07-17","转换方式：exports - imports；当前仅作为研究数据结构字段，不代表模型已启用。"
"current_account_gdp","经常账户/GDP","Current account / GDP","external","外部经济","% GDP","annual","V4 四国","2021-2025","Eurostat tipsbp20","各国央行 / 国际收支统计 / IMF Balance of Payments","A","true","false","false","true","true","true","true","true","数值上升通常代表经常账户余额改善；负值扩大代表外部融资需求上升。","不使用插值；若年度缺失，保留缺失并标注待接入。","待接入行保留指标单位，数值显示待接入，状态与来源状态均显示待接入。","2026-07-17","转换方式：level；当前仅作为研究数据结构字段，不代表模型已启用。"
"fdi_inflow","FDI 流入","FDI inflow","investment","投资","百万欧元","annual","V4 四国","2021-2025","Eurostat bop_fdi6_flow","各国央行 / 投资促进机构 / UNCTAD / OECD FDI","A","true","false","false","true","true","true","true","true","数值上升通常代表直接投资流入增加；负值可代表撤资、还款或权益减少，需结合来源注释解释。","不使用插值；负值保留为真实观测；缺失值保留缺失并标注待接入。","待接入行保留指标单位，数值显示待接入，状态与来源状态均显示待接入。","2026-07-17","转换方式：level；当前仅作为研究数据结构字段，不代表模型已启用。"
"energy_import_dependency","能源进口依赖","Energy import dependency","energy","能源","%","annual","V4 四国","2021-2025","Eurostat nrg_ind_id","各国能源统计部门 / 能源监管机构","A","true","false","false","true","true","true","true","true","数值上升通常代表能源供应对进口依赖程度提高。","不使用插值；若年度缺失，保留缺失并标注待接入。","待接入行保留指标单位，数值显示待接入，状态与来源状态均显示待接入。","2026-07-17","转换方式：level；当前仅作为研究数据结构字段，不代表模型已启用。"
"manufacturing_share_gdp","制造业占 GDP 比重","Manufacturing GVA / GDP","industry","产业","%","annual","V4 四国","2021-2025","Eurostat nama_10_a10","各国统计部门国民账户","A","true","false","false","true","true","true","true","true","数值上升通常代表制造业在经济结构中的比重提高。","不使用插值；若年度缺失，保留缺失并标注待接入。","待接入行保留指标单位，数值显示待接入，状态与来源状态均显示待接入。","2026-07-17","转换方式：level；当前仅作为研究数据结构字段，不代表模型已启用。"
"automotive_export_share","汽车产业出口占比","Automotive industry export share","industry","产业","%","annual","V4 四国","2021-2025","Eurostat ext_tec09","各国海关 / 外贸统计 / 汽车行业协会","A","false","true","false","true","true","true","true","true","数值上升通常代表汽车产业在出口结构中的集中度提高。","若 NACE C29 或总出口缺失，则保留缺失；不以相邻年份替代。","待接入行保留指标单位，数值显示待接入，状态与来源状态均显示待接入。","2026-07-17","转换方式：NACE C29 exports / total exports；当前仅作为研究数据结构字段，不代表模型已启用。"
